(Hotkey: {0}),,(Schnelltaste: {0}),(Raccourci : {0}),(клавиша: {0}),（快捷键：{0}）,(ホットキー: {0}),(Atajo: {0}),(단축키: {0}),(Kısayol tuşu: {0}),(клавіша: {0}),(Atalho: {0}),(klávesa: {0}),(Klawisz: {0})
"The glyph of calcification transmutes any of the four cardinal elements-- air, fire, water, and earth-- into neutral salt.",,"Die Glyphe der Kalzifizierung wandelt ein beliebiges Hauptelement (Luft, Feuer, Wasser oder Erde) in neutrales Salz um.","Le glyphe de calcification transmute n'importe lequel des quatre éléments (eau, feu, air, terre) en sel neutre.","Глиф отверждения превращает любой их четырех основных элементов – воздух, огонь, воду или землю – в нейтральную соль.",“钙化符文”可将四种基本元素（风、火、水和土）中的任何一种转化为中性盐。,石灰化の●象形文字は、空気、火、水、土の●4つの●基本元素の●いずれかを●中性塩に●変換します。,"El glifo de calcificación transmuta cualquiera de los cuatro elementos cardinales: aire, fuego, agua y tierra, en sal neutra.","염화의 문양은 모든 주요 원소(물, 불, 공기, 흙)를 소금으로 바꿉니다.","Kireçleme glifi hava, ateş, su ve toprak gibi dört ana elementten herhangi birini nötr tuza dönüştürür.","Гліф отвердіння трансмутує будь-який з чотирьох головних елементів (повітря, вогонь, воду і землю) у нейтральну сіль.","O glifo da calcificação transforma qualquer um dos quatro elementos cardeais -- ar, fogo, água e terra-- em sal neutro.","Glyf kalcifikace přeměňuje jeden ze čtyř primárních elementů - vzduch, oheň, vodu a zemi - na neutrální sůl.","Glif zwapniania zamienia jakikolwiek żywioł - powietrze, ogień, wodę i ziemię - w neutralną sól."
The glyph of dispersion transmutes one atom of quintessence into one atom of each of the four cardinal elements.,,Die Glyphe der Verteilung wandelt ein Atom der Quintessenz in ein Atem jedes der vier Hauptelemente.,Le glyphe de dispersion transmute un atome de quintessence en un atome de chacun des quatre éléments fondamentaux.,Глиф рассеяния превращает один атом квинтэссенции в один атом каждого из четырех основных элементов.,“驱散之符”可将一个以太原子转化成一个四大基本元素之一的原子。,分散の●象形文字は、●真髄の●原子1つを●4つの●各基本元素の●原子1つに●変換します。,El glifo de dispersión transmuta un átomo de quintaesencia en un átomo de cada uno de los cuatro elementos cardinales.,분산의 문양은 퀸터센스 원자 하나를 주요 원소 4개로 분리합니다.,"Çözelti glifi, bir öz atomunu dört kardinal elementin her birinin bir atomuna dönüştürür.",Гліф дисперсії трансмутує один атом квінтесенції у чотири різних атоми кожного із головних елементів.,O glifo da dispersão transmuta um átomo de quintessência em um átomo de cada um dos quatro elementos cardeais.,Glyf rozptýlení přeměňuje jeden atom kvintesence na jeden atom některého ze čtyř primárních elementů.,Glif rozproszenia zamienia jeden atom kwintesencji w jeden atom każdego żywiołu.
The glyph of disposal removes unneeded atoms from the board.,,Die Glyphe der Entsorgung entfernt nicht benötigte Atome von der Tafel.,Le glyphe de traitement retire les atomes inutiles du plateau.,Глиф утилизации убирает со стола ненужные атомы.,“清除符文”可从面板上移除不需要的原子。,処理の●象形文字は●不要な●原子を●ボードから●削除します。,El glifo de eliminación remueve los átomos innecesarios del tablero.,처분의 문양은 필요없는 원자를 제거합니다.,"Bertaraf glifi, gereksiz atomları tahtadan kaldırır.",Гліф знищення видаляє непотрібні атоми зі столу.,O glifo do descarte remove átomos desnecessários do tabuleiro.,Glyf uspořádání odstraňuje ze stolu nepotřebné atomy.,Glif utylizacji usuwa niepotrzebne atomy z planszy.
The glyph of duplication transmutes a salt atom into one of the four cardinal elements by imbuing it with the essence of an existing atom.,,"Die Glyphe der Verdopplung wandelt ein Salzatom in eines der vier Hauptelemente um, indem sie es mit der Essenz eines bestehenden Atoms erfüllt.",Le glyphe de duplication transmute un atome de sel en l'un des quatre éléments en l'imprégnant de l'essence d'un atome existant.,"Глиф копирования превращает атом соли в один из четырех основных элементов, наделяя его энергией уже существующего атома.",“复制符文”可通过将现有原子的精华注入盐原子，把一个盐原子转化为四种基本元素之一。,複製の●象形文字は、●塩原子の●一つを●既存の原子の●元素に●植え付ける●ことで、4つの●基本元素の●いずれかに●変換させます。,El glifo de duplicación transmuta un átomo de sal en uno de los cuatro elementos cardinales al transmitirle la esencia de un átomo existente.,복제의 문양은 올려져 있는 주요 원소의 정수를 불어넣어 소금 원자를 해당 주요 원소로 변성시킵니다.,"Çoğaltma glifi, bir tuz atomunu mevcut bir atomun özüyle birleştirerek dört kardinal elementten birine dönüştürür.","Гліф відтворення трансмутує атом солі у один з чотирьох головних елементів, наділяючи його сутністю вже наявного атому.",O glifo da duplicação transmuta um átomo de sal em um dos quatro elementos cardeais ao imbuí-lo com a essência de um átomo existente.,"Glyf duplikace přeměňuje atom soli na jeden ze čtyř primárních elementů, prodchnutý esencí existujícího atomu.",Glif duplikacji zamienia atom soli w jeden z czterech żywiołów pod wpływem istniejącego atomu.
The glyph of multi-bonding can create up to three bonds at once.,,Die Glyphe der Multi-Bindung kann bis zu drei Verbindungen auf einmal erzeugen.,Le glyphe de liens multiples peut créer jusqu'à trois liens en tout.,Глиф множественных связей позволяет создать до трех связей одновременно.,“多重键合符文”可一次创建三个原子键。,多重結合の●象形文字は●一度に●最大●3つの●結合を●作成できます。,El glifo de uniones múltiples puede crear hasta tres uniones a la vez.,다중 결합의 문양은 3개의 결합까지 한번에 만들 수 있습니다.,Çoklu bağ glifi bir kerede en fazla üç bağ oluşturabilir.,Гліф множинного зв'язку дозволяє одночасно створити до трьох зв'язків.,O glifo de ligação múltipla pode criar até três ligações ao mesmo tempo.,Glyf multispojení může vytvořit až tři spojení najednou.,Glif wielokrotnego wiązania może utworzyć do trzech wiązań naraz.
The glyph of projection consumes an atom of quicksilver and promotes an atom of metal to its next higher form.,,Die Glyphe der Projektion verbraucht ein Quecksilberatom und veredelt ein Metallatom auf seine nächsthöhere Stufe.,Le glyphe de projection consomme un atome de mercure pour améliorer la qualité d'un atome de métal.,"Глиф улучшения поглощает атом ртути и улучшает один атом металла до следующей, более совершенной формы.",“投射符文”可消耗一个水银原子，并提升一个金属原子到它的下一个更高形式。,投影の●象形文字は●水銀の原子を●消費し、金属の原子を●もう一段階●上の形に●昇格します。,El glifo de proyección consume un átomo de plata y promueve un átomo de metal a su siguiente forma superior.,투영의 문양은 수은 원자를 소모해서 금속 원자를 다음 단계로 올립니다.,İzdüşüm glifi bir cıva atomunu tüketir ve bir metal atomunu bir sonraki yüksek formuna yükseltir.,"Гліф проєкції споживає атом ртуті й трансмутує атом металу у його наступну, вищу, форму.",O glifo da projeção consome um átomo de mercúrio e promove um átomo de metal à sua próxima forma mais elevada.,Glyf přeměny spotřebuje jeden atom rtuti a pozvedne atom kovu na jeho vyšší úroveň.,Glif projekcji przy użyciu atomu rtęci promuje atom metalu do jego wyższej formy.
The glyph of purification transmutes two atoms of the same metal into a single atom of their next higher form.,,Die Glyphe der Reinigung wandelt zwei Atome desselben Metalls in ein einzelnes Atom der nächsthöheren Stufe dieses Metalls um.,Le glyphe de purification transmute deux atomes du même métal en un seul d'une qualité supérieure.,"Глиф очищения превращает два атома одного и того же металла в один атом следующей, более совершенной формы.",“提纯符文”可把两个相同的金属原子转化成其更高形式的单个原子。,精製の●象形文字は●同じ金属原子2つを●、もう一段階●上の形の●原子1つ分に●変換します。,El glifo de purificación transmuta dos átomos del mismo metal en un solo átomo de su siguiente forma superior. ,정제의 문양은 같은 금속 원자 두개를 소모해서 다음 단계의 금속을 만들어냅니다.,"Arıtma glifi, aynı metalin iki atomunu bir sonraki daha yüksek formlarının tek bir atomuna dönüştürür.",Гліф очищення трансмутує два атоми однакового металу в один атом їхньої вищої форми.,O glifo da purificação transmuta dois átomos do mesmo metal em um único átomo de sua próxima forma mais elevada.,Glyf očištění přeměňuje dva atomy stejného kovu na jeden atom jejich další vyšší úrovně.,Glif oczyszczenia zamenia dwa atomy metalu w jeden atom metalu wyższej formy.
"The glyph of triplex-bonding creates three separate types of bonds between fire atoms that, when overlaid, become a triplex bond.",,"Die Glyphe der Triplex-Bindung erzeugt drei separate Verbindungsarten zwischen Feueratomen, die zu einer Triplex-Bindung werden, wenn sie sich überlagern.","Le glyphe de liens triplex crée trois différents types de liens entre les atomes de feu qui, une fois superposés, deviennent un lien triplex.","Глиф тройной связи создает между атомами огня три отдельных типа связей, которые при наложении превращаются в тройную связь.",“三重键合符文”可在火原子之间形成三种不同类型的原子键，而当它们重叠时，就变成“三重键合”。,三重結合の●象形文字は●重ね合わせた●ときに●三重結合になる、火の原子の間に●3種類の●個別の結合を●作成します。,"El glifo de unión triple crea tres tipos separados de uniones entre los átomos de fuego que, cuando se superponen, se convierten en un enlace triple.",삼중 결합의 문양은 불 원자 사이에 세 종류의 결합을 생성합니다. 세 결합이 전부 중첩되어야만 삼중 결합이 완성됩니다.,"Üç katlı bağ glifi, ateş atomları arasında, üst üste bindiğinde üç katlı bağlı haline gelen üç ayrı bağ türü oluşturur.","Гліф триєдності створює три окремі типи зв'язків між атомами вогню, які, накладаючись, утворюють триєдиний зв'язок.","O glifo da ligação tríplice cria três tipos separados de ligações entre átomos de fogo que, quando juntos, se tornam uma ligação tríplice.","Glyf trojspojení vytváří tři různé druhy spojení mezi atomy ohně, které se při překrytí stávají trojspojením.",Glif potrójnego wiązania tworzy trzy różne typy wiązań między atomami ognia. Wspólnie tworzą one wiązanie potrójne.
The glyph of unbonding eliminates the bond between two atoms.,,Die Glyphe der Nullbindung hebt die Verbindung zwischen zwei Atomen auf.,Le glyphe de rupture élimine les liens entre deux atomes.,Глиф разрушения связей разрушает связь между двумя атомами.,“消除键合符文”可把两个原子间的原子键消除。,非結合の●象形文字は●2つの原子の●間の●結合を●削除します。,El glifo de separación elimina uniónes entre dos átomos.,분리의 문양은 두 원자 사이의 결합을 끊습니다.,"Bağ çözme glifi, iki atom arasındaki bağı ortadan kaldırır.",Гліф розрізу усуває зв'язок між двома атомами.,O glifo da quebra de ligação elimina a ligação entre dois átomos.,Glyf rozpojení odstraňuje spojení mezi dvěma atomy.,Glif rozwiązywania usuwa wiązanie między atomami.
The glyph of unification transmutes one atom of each of the four cardinal elements into one atom of quintessence.,,Die Glyphe der Vereinigung wandelt ein Atom jedes der vier Hauptelemente in ein Atom der Quintessenz.,Le glyphe d'unification transmute un atome de chacun des quatre éléments fondamentaux en un atome de quintessence.,Глиф объединения превращает по одному атому каждого из четырех основных элементов в один атом квинтэссенции.,“融合符文”可将一个四大基本元素之一的原子转化成一个以太原子。,結合の●象形文字は、●4つの●各基本元素の●原子1つを●真髄の●原子1つに●変換します。,El glifo de unificación transmuta un átomo de cada uno de los cuatro elementos cardinales en un átomo de quintaesencia.,융합의 문양은 4종류의 주요 원소의 원자를 하나씩 사용해서 퀸터센스 원자 하나를 만듭니다.,"Birleştirme glifi, dört kardinal elementin her birinin bir atomunu bir öz atomuna dönüştürür.",Гліф уніфікації трансмутує чотири різних атоми кожного із головних елементів у один атом квінтесеції.,O glifo da unificação transmuta um átomo de cada um dos quatro elementos cardeais em um átomo de quintessência.,Glyf sjednocení přeměňuje jeden atom kteréhokoliv ze čtyř primárních elementů na jeden atom kvintesence.,Glif unifikacji zamienia po jednym atomie każdego żywiołu w jeden atom kwintesencji.
"The metals match with quicksilver, but only in the order of their transmutation from lead to gold.",,"Die Metalle können zu Quecksilber zugeordnet werden, aber nur in der Reihenfolge ihrer Transmutation, von Blei zu Gold.","Les métaux s'associent au mercure, mais uniquement dans l'ordre de leur transmutation du plomb en or.","Металлы сочетаются с ртутью – но только в порядке их трансмутации, от свинца к золоту.",金属跟水银匹配，但只能按照从铅到黄金的嬗变顺序来匹配它们。,金属と●水銀も●マッチさせられる。●ただし、●鉛から●黄金までの●変成の●順番に●応じる●必要がある。,"Los metales se puede combinar con el mercurio, pero solo en el orden de su transmutación de plomo a oro.","금속들은 수은과 조합할 수 있지만, 납부터 금까지의 변성 순서대로 조합해야 합니다.","Metaller cıva ile eşleşir, ancak sadece kurşundan altına dönüşümleri sırasında.","Метали поєднуються тільки зі ртуттю, але лише за порядком їх трансмутації від свинцю до золота.","Os metais se combinam com mercúrio, mas só na ordem de sua transmutação de chumbo a ouro.","Kovy se slučují se rtutí, ale jen při jejich transmutaci od olova ke zlatu.","Metale łączą się z rtęcią, ale tylko w kolejności ich transmutacji od ołowiu do złota."
The previously uploaded Workshop item could not be found. Please upload again to create a new item.,,"Zuvor hochgeladenes Workshop-Objekt nicht gefunden. Bitte erneut hochladen, um ein Neues zu erstellen.",L'objet partagé sur le Workshop n'a pas pu être trouvé. Téléchargez-le à nouveau pour créer un nouvel objet.,"Не удается найти объект, отправленный в Мастерскую. Повторите отправку, чтобы создать новый объект.",未找到先前上传创意工坊的文件。请再次上传以创建新文件。,以前にワークショップに●アップロードされた●アイテムが●見つかりませんでした。新しいアイテムを●作成するには、もう一度●アップロードして●ください。,"El ítem del Workshop previamente cargado no se pudo encontrar. Por favor, vuelva a subirlo para crear un nuevo ítem.",이전에 창작마당에 업로드한 퍼즐을 찾을 수 없습니다. 다시 업로드해주세요.,Önceden yüklenen Atölye öğesi bulunamadı. Yeni bir öğe oluşturmak için lütfen tekrar yükleyin.,"Не вдається знайти попередньо вивантажений об'єкт Майстерні Steam. Будь ласка, вивантажте ще раз для створення нового об'єкта.",O item anteriormente enviado à Oficina não pôde ser encontrado. Por favor envie novamente para criar um novo item.,"Položka, uploadovaná do Workshopu, nebyla nalezena. Pro vytvoření položky proveďte nový upload.","Nie znaleziono poprzednio przesłanego przedmiotu z Warsztatu. Prześlij jeszcze raz, aby stworzyć nowy przedmiot."
The upload timed out. Please try again.,,Zeitüberschreitung beim Upload. Bitte versuche es erneut.,Le temps de partage a expiré. Veuillez essayer à nouveau.,Время отправки истекло. Повторите попытку.,上传超时。请再试一次。,アップロードが●タイムアウトしました。もう一度●お試しください。,La carga ha caducado. Inténtalo de nuevo.,업로드 시간이 초과되었습니다. 다시 시도해주세요.,Yükleme zaman aşımına uğradı. Lütfen tekrar deneyin.,"Час вивантаження завершився. Будь ласка, спробуйте ще раз.","O envio perdeu a conexão. Por favor, tente novamente.",Čas uploadu vypršel. Zkuste to znovu.,Przesyłanie się przedawniło. Spróbuj ponownie.
Then add *instructions* to make it pick up the reagent and move it to the product output.,,"Füge dann *Anweisungen* hinzu, damit er das Reagenz aufnimmt und zur Erzeugnisausgabe bewegt.",Ajoutez ensuite des *instructions* pour le faire ramasser le réactif et l'amener vers le produit.,"Затем добавьте *команды*, чтобы захватить реагент и переместить его в зону выхода продукта.",然后添加*指令*，使其拾取试剂并移动至产品输出。,次に、試薬を●取り出し、生成物の●出力に●移動させる●*命令*を●追加します。,Luego agrega *instrucciones* para hacer que recoja el reactivo y lo mueva a la salida del producto.,그리고 *명령*을 추가해서 팔이 반응물을 생성물 출력에 옮기게 합니다.,"Ardından, reaktifi alması ve ürün çıktısına taşıması için *talimatlar* ekleyin.","Потім додайте йому *команди*, щоб він взяв реагент і поклав його у місце виходу продукту.",Então adicione *instruções* para fazê-lo agarrar o reagente e mover ele ao destino dos produtos.,Pak přidejte *instrukce* ke zvednutí reagentu a jeho přenesení do výrobního výstupu.,"Następnie dodaj *instrukcje*, aby sprawić, że podniesie reagent i przeniesie go do wyjścia produktu."
Then add *instructions* to the instruction tray below to make it pick up the reagent and move it to the product output.,,"Füge dann *Anweisungen* in der Anweisungskonsole hinzu, damit er das Reagenz aufnimmt und zur Erzeugnisausgabe bewegt.",Ajoutez ensuite des *instructions* sur la planche pour le faire ramasser le réactif et l'amener vers le produit.,"Затем добавьте на панель команд *команды*, чтобы захватить реагент и переместить его в зону выхода продукта.",然后添加*指令*至指令叠，使其拾取试剂并移动至产品输出。,次に、*命令*を●命令トレイに●追加して、試薬を●取り出し、生成物の●出力に●移動させるように●します。,Luego agrega *instrucciones* a la bandeja de instrucciones debajo para que recoja el reactivo y lo mueva a la salida del producto.,그리고 *명령*을 명령 선반에 추가해서 팔이 반응물을 생성물 출력에 옮기게 합니다.,"Ardından, reaktifi almasını ve ürün çıktısına taşımasını sağlamak için aşağıdaki talimat tepsisine *talimatlar* ekleyin.","Потім додайте йому *команди* на *панелі команд* унизу, щоб він взяв реагент і поклав його у місце виходу продукту.",Então adicione *instruções* ao tabuleiro de instruções abaixo para fazê-lo agarrar o reagente e mover ele ao destino dos produtos.,Pak přidejte do lišty instrukcí *instrukce* ke zvednutí reagentu a jeho přenesení do výrobního výstupu.,"Następnie dodaj *instrukcje* na pasek instrukcji poniżej, aby sprawić, że podniesie reagent i przeniesie go do wyjścia produktu."
Then place an *arm* on the track and add *instructions* to make it pick up the reagent and move it to the product output.,,"Platziere dann einen *Arm* auf der Führungsschiene und füge *Anweisungen* hinzu, damit er das Reagenz aufnimmt und zur Erzeugnisausgabe bewegt.",Placez ensuite un *bras* sur le rail et ajoutez des *instructions* pour le faire ramasser le réactif et l'amener vers le produit.,"Затем поместите на направляющую *манипулятор* и добавьте *команды*, чтобы манипулятор захватил реагент и перенес его в зону выхода продукта.",然后在轨道放置一个*机械臂*，并添加*指令*，使其拾取试剂并移动至产品输出。,次に、*アーム*を●トラック上に●配置し、*命令*を●追加して、試薬を●取り出し、生成物の●出力に●移動させるように●します。,Luego coloca un *brazo* en el carril y agrega *instrucciones* para hacer que recoja el reactivo y lo mueva a la salida del producto.,그리고 *팔*을 선로에 배치하고 *명령*을 추가해서 팔이 반응물을 생성물 출력에 옮기게 합니다.,Ardından parçaya bir *kol* yerleştirin ve reaktifi alması ve ürün çıkışına taşıması için *talimatlar* ekleyin.,"Потім поставте на неї *маніпулятор* та додайте йому *команди*, щоб він взяв реагент і поклав його у місце виходу продукту.",Então coloque um *braço* no trilho e adicione *instruções* para fazê-lo agarrar o reagente e movê-lo ao destino dos produtos.,Pak přidejte na dráhu *manipulátor* a přidejte do lišty instrukcí *instrukce* ke zvednutí reagentu a jeho přenesení do výrobního výstupu.,"Następnie umieść *ramię* na torze i dodaj *instrukcje*, aby sprawić, że podniesie reagent i przeniesie go do wyjścia produktu."
There is already another part here.,,Hier befindet sich bereits ein anderes Teil.,Il y a déjà une autre pièce.,Здесь уже находится другая часть.,这里已经有另一个零件了。,ここには●既に●別のパーツが●存在します。,Ya hay otra parte aquí.,이미 다른 부품이 있습니다.,Burada başka bir parça daha var.,Тут вже знаходиться інша частина.,Já tem outra peça aqui.,Zde už další součástka je.,Tu już jest inna część.
There must be an atom at the center of the board.,,In der Mitte der Tafel muss sich ein Atom befinden.,Un atome doit se trouver au centre du plateau.,В центре стола должен находиться атом.,面板的中心一定要有一个原子。,ボードの●中央には●原子が●なければ●なりません。,Debe haber un átomo en el centro del tablero.,판 중앙에 원자가 있어야 합니다.,Tahtanın ortasında bir atom olmalıdır.,У центрі дошки повинен бути атом.,Deve haver um átomo no centro do tabuleiro.,Uprostřed stolu se musí nacházet atom.,Na środku planszy musi być atom.
These are *reagents*.,,Dies sind *Reagenzien*.,Voici des *réactifs*.,Это *реагенты*.,这些是*试剂*。,これらは●*試薬*です。,Estos son *reactivos*.,이것들은 *반응물*입니다.,Bunlar *reaktiflerdir*.,Це *реагенти*.,Estes são *reagentes*.,Toto jsou *reagenty*.,To są *reagenty*.
